{"evidence_handles":[{"collection_status":"collected","digest":{"algorithm":"sha256","value":"462195923b315d0c09f64aa613a0f6a179d144968d167aae6fda3d892511781f"},"handle":"evidence:reference-trace","kind":"trace","redaction_status":"not_required"}],"limitations":[],"observations":[{"accepted_delivery_attempt_id":"30ed3519-ef20-59d5-9cf8-5912510388fd","attempts":[{"decision":"deny","decision_tick":6,"elapsed_ns_from_acceptance":1000}],"component_id":"reference-contextual-sut","evidence_refs":["evidence:reference-trace"],"observation_id":"observation:probe:decision:0dfae056-71c6-5101-b707-6f26f9e82346","observation_type":"access_decision","policy_version_ids":["2718eb01-df5d-5694-a41d-33015a5ae010","b752a0bc-dd84-5b9c-afc9-8fe45a7fa417"],"probe_id":"probe:decision:0dfae056-71c6-5101-b707-6f26f9e82346","request_id":"0dfae056-71c6-5101-b707-6f26f9e82346","trigger_event_id":"300a784e-982e-52e1-9dc0-17a30668be7e"},{"accepted_delivery_attempt_id":"35e6055e-25be-57b7-8bda-da412856e34c","attempts":[{"decision":"deny","decision_tick":6,"elapsed_ns_from_acceptance":1000}],"component_id":"reference-contextual-sut","evidence_refs":["evidence:reference-trace"],"observation_id":"observation:probe:decision:1466e3e3-ac93-5fef-8e27-41b60346a7c1","observation_type":"access_decision","policy_version_ids":["2718eb01-df5d-5694-a41d-33015a5ae010","b752a0bc-dd84-5b9c-afc9-8fe45a7fa417"],"probe_id":"probe:decision:1466e3e3-ac93-5fef-8e27-41b60346a7c1","request_id":"1466e3e3-ac93-5fef-8e27-41b60346a7c1","trigger_event_id":"3456fae8-ce0f-5ae0-84b3-70c435bde77c"},{"accepted_delivery_attempt_id":null,"attempts":[{"decision":"allow","decision_tick":1,"elapsed_ns_from_acceptance":null}],"component_id":"reference-contextual-sut","evidence_refs":["evidence:reference-trace"],"observation_id":"observation:probe:decision:266ca67e-4ab6-576c-a0a8-35ac6ef528b6","observation_type":"access_decision","policy_version_ids":["2718eb01-df5d-5694-a41d-33015a5ae010","b752a0bc-dd84-5b9c-afc9-8fe45a7fa417"],"probe_id":"probe:decision:266ca67e-4ab6-576c-a0a8-35ac6ef528b6","request_id":"266ca67e-4ab6-576c-a0a8-35ac6ef528b6","trigger_event_id":null},{"accepted_delivery_attempt_id":null,"attempts":[{"decision":"deny","decision_tick":1,"elapsed_ns_from_acceptance":null}],"component_id":"reference-contextual-sut","evidence_refs":["evidence:reference-trace"],"observation_id":"observation:probe:decision:32355049-401c-5336-8694-df3844548ed8","observation_type":"access_decision","policy_version_ids":["2718eb01-df5d-5694-a41d-33015a5ae010","b752a0bc-dd84-5b9c-afc9-8fe45a7fa417"],"probe_id":"probe:decision:32355049-401c-5336-8694-df3844548ed8","request_id":"32355049-401c-5336-8694-df3844548ed8","trigger_event_id":null},{"accepted_delivery_attempt_id":"f49a350b-03c4-5d80-bcfb-098e34f37925","attempts":[{"decision":"deny","decision_tick":7,"elapsed_ns_from_acceptance":1000}],"component_id":"reference-contextual-sut","evidence_refs":["evidence:reference-trace"],"observation_id":"observation:probe:decision:432144a7-90db-5099-ad31-4eeab3ae432f","observation_type":"access_decision","policy_version_ids":["2718eb01-df5d-5694-a41d-33015a5ae010","b752a0bc-dd84-5b9c-afc9-8fe45a7fa417"],"probe_id":"probe:decision:432144a7-90db-5099-ad31-4eeab3ae432f","request_id":"432144a7-90db-5099-ad31-4eeab3ae432f","trigger_event_id":"101117d5-ed68-5487-a6e0-8a7163dd0a9f"},{"accepted_delivery_attempt_id":"1f4ab460-a7b3-5c46-8fe8-ccd7f5249f85","attempts":[{"decision":"deny","decision_tick":6,"elapsed_ns_from_acceptance":1000}],"component_id":"reference-contextual-sut","evidence_refs":["evidence:reference-trace"],"observation_id":"observation:probe:decision:521020ba-83c0-5b20-bcbe-245f4cd00f4e","observation_type":"access_decision","policy_version_ids":["2718eb01-df5d-5694-a41d-33015a5ae010","b752a0bc-dd84-5b9c-afc9-8fe45a7fa417"],"probe_id":"probe:decision:521020ba-83c0-5b20-bcbe-245f4cd00f4e","request_id":"521020ba-83c0-5b20-bcbe-245f4cd00f4e","trigger_event_id":"29ff7032-58c9-5a0d-bc04-3099be0b19c3"},{"accepted_delivery_attempt_id":null,"attempts":[{"decision":"deny","decision_tick":5,"elapsed_ns_from_acceptance":null}],"component_id":"reference-contextual-sut","evidence_refs":["evidence:reference-trace"],"observation_id":"observation:probe:decision:85b49a5e-9fbe-529e-a0cf-d12a3e4ec5c8","observation_type":"access_decision","policy_version_ids":["2718eb01-df5d-5694-a41d-33015a5ae010","b752a0bc-dd84-5b9c-afc9-8fe45a7fa417"],"probe_id":"probe:decision:85b49a5e-9fbe-529e-a0cf-d12a3e4ec5c8","request_id":"85b49a5e-9fbe-529e-a0cf-d12a3e4ec5c8","trigger_event_id":null},{"accepted_delivery_attempt_id":"20c794b9-f734-55f2-844f-516a0001e1e0","attempts":[{"decision":"deny","decision_tick":6,"elapsed_ns_from_acceptance":1000}],"component_id":"reference-contextual-sut","evidence_refs":["evidence:reference-trace"],"observation_id":"observation:probe:decision:a8f2be95-b5bf-5bd0-a624-8f459f0f6ca7","observation_type":"access_decision","policy_version_ids":["2718eb01-df5d-5694-a41d-33015a5ae010","b752a0bc-dd84-5b9c-afc9-8fe45a7fa417"],"probe_id":"probe:decision:a8f2be95-b5bf-5bd0-a624-8f459f0f6ca7","request_id":"a8f2be95-b5bf-5bd0-a624-8f459f0f6ca7","trigger_event_id":"396a39e6-8fcb-5da8-8f80-333dbffbbd61"},{"accepted_delivery_attempt_id":null,"attempts":[{"decision":"deny","decision_tick":5,"elapsed_ns_from_acceptance":null}],"component_id":"reference-contextual-sut","evidence_refs":["evidence:reference-trace"],"observation_id":"observation:probe:decision:cf3c46f9-1a6f-5533-9be1-897dea33a1cc","observation_type":"access_decision","policy_version_ids":["2718eb01-df5d-5694-a41d-33015a5ae010","b752a0bc-dd84-5b9c-afc9-8fe45a7fa417"],"probe_id":"probe:decision:cf3c46f9-1a6f-5533-9be1-897dea33a1cc","request_id":"cf3c46f9-1a6f-5533-9be1-897dea33a1cc","trigger_event_id":null},{"accepted_delivery_attempt_id":"9ff206c0-5d3b-5dae-b308-e26efbc61e03","attempts":[{"decision":"allow","decision_tick":8,"elapsed_ns_from_acceptance":1000}],"component_id":"reference-contextual-sut","evidence_refs":["evidence:reference-trace"],"observation_id":"observation:probe:decision:ebd16901-8625-5729-8986-ecf17440e5f4","observation_type":"access_decision","policy_version_ids":["2718eb01-df5d-5694-a41d-33015a5ae010","b752a0bc-dd84-5b9c-afc9-8fe45a7fa417"],"probe_id":"probe:decision:ebd16901-8625-5729-8986-ecf17440e5f4","request_id":"ebd16901-8625-5729-8986-ecf17440e5f4","trigger_event_id":"3138b0a7-f9e3-5e5d-a27b-77e18c588027"},{"acceptance_elapsed_ns":500,"accepted":true,"component_id":"reference-context-feed","delivery_attempt_id":"1f4ab460-a7b3-5c46-8fe8-ccd7f5249f85","event_id":"29ff7032-58c9-5a0d-bc04-3099be0b19c3","evidence_refs":["evidence:reference-trace"],"observation_id":"observation:probe:delivery:1f4ab460-a7b3-5c46-8fe8-ccd7f5249f85","observation_type":"delivery_acceptance","observed_delivery_tick":5,"probe_id":"probe:delivery:1f4ab460-a7b3-5c46-8fe8-ccd7f5249f85","projected_event_tick":5,"set_issue_tick":5},{"acceptance_elapsed_ns":500,"accepted":true,"component_id":"reference-context-feed","delivery_attempt_id":"20c794b9-f734-55f2-844f-516a0001e1e0","event_id":"396a39e6-8fcb-5da8-8f80-333dbffbbd61","evidence_refs":["evidence:reference-trace"],"observation_id":"observation:probe:delivery:20c794b9-f734-55f2-844f-516a0001e1e0","observation_type":"delivery_acceptance","observed_delivery_tick":10,"probe_id":"probe:delivery:20c794b9-f734-55f2-844f-516a0001e1e0","projected_event_tick":5,"set_issue_tick":5},{"acceptance_elapsed_ns":500,"accepted":true,"component_id":"reference-context-feed","delivery_attempt_id":"30ed3519-ef20-59d5-9cf8-5912510388fd","event_id":"300a784e-982e-52e1-9dc0-17a30668be7e","evidence_refs":["evidence:reference-trace"],"observation_id":"observation:probe:delivery:30ed3519-ef20-59d5-9cf8-5912510388fd","observation_type":"delivery_acceptance","observed_delivery_tick":5,"probe_id":"probe:delivery:30ed3519-ef20-59d5-9cf8-5912510388fd","projected_event_tick":5,"set_issue_tick":5},{"acceptance_elapsed_ns":500,"accepted":true,"component_id":"reference-context-feed","delivery_attempt_id":"35e6055e-25be-57b7-8bda-da412856e34c","event_id":"3456fae8-ce0f-5ae0-84b3-70c435bde77c","evidence_refs":["evidence:reference-trace"],"observation_id":"observation:probe:delivery:35e6055e-25be-57b7-8bda-da412856e34c","observation_type":"delivery_acceptance","observed_delivery_tick":5,"probe_id":"probe:delivery:35e6055e-25be-57b7-8bda-da412856e34c","projected_event_tick":5,"set_issue_tick":5},{"acceptance_elapsed_ns":500,"accepted":true,"component_id":"reference-context-feed","delivery_attempt_id":"8bd879ae-e736-5477-92f6-e26542ed4b15","event_id":"53d80d09-3985-5789-924d-aaab315dfda2","evidence_refs":["evidence:reference-trace"],"observation_id":"observation:probe:delivery:8bd879ae-e736-5477-92f6-e26542ed4b15","observation_type":"delivery_acceptance","observed_delivery_tick":7,"probe_id":"probe:delivery:8bd879ae-e736-5477-92f6-e26542ed4b15","projected_event_tick":6,"set_issue_tick":6},{"acceptance_elapsed_ns":500,"accepted":true,"component_id":"reference-context-feed","delivery_attempt_id":"9ff206c0-5d3b-5dae-b308-e26efbc61e03","event_id":"3138b0a7-f9e3-5e5d-a27b-77e18c588027","evidence_refs":["evidence:reference-trace"],"observation_id":"observation:probe:delivery:9ff206c0-5d3b-5dae-b308-e26efbc61e03","observation_type":"delivery_acceptance","observed_delivery_tick":7,"probe_id":"probe:delivery:9ff206c0-5d3b-5dae-b308-e26efbc61e03","projected_event_tick":5,"set_issue_tick":5},{"acceptance_elapsed_ns":500,"accepted":true,"component_id":"reference-context-feed","delivery_attempt_id":"c8f147ea-b6e3-5671-b820-e0a3eb6e79b7","event_id":"101117d5-ed68-5487-a6e0-8a7163dd0a9f","evidence_refs":["evidence:reference-trace"],"observation_id":"observation:probe:delivery:c8f147ea-b6e3-5671-b820-e0a3eb6e79b7","observation_type":"delivery_acceptance","observed_delivery_tick":6,"probe_id":"probe:delivery:c8f147ea-b6e3-5671-b820-e0a3eb6e79b7","projected_event_tick":5,"set_issue_tick":5},{"acceptance_elapsed_ns":500,"accepted":true,"component_id":"reference-con